[
  {
    "id": "merkur",
    "name": "Münchner Merkur",
    "color": "#008bd0",
    "logo": "img/logos/merkur.svg"
  },
  {
    "id": "sz",
    "name": "Süddeutsche Zeitung",
    "color": "#29293a",
    "logo": "img/logos/sz.svg"
  },
  {
    "id": "br",
    "name": "Bayerischer Rundfunk",
    "color": "#0082c6",
    "logo": "img/logos/br.svg"
  },
  {
    "id": "mz",
    "name": "Moosburger Zeitung",
    "color": "#e20c15",
    "logo": "img/logos/moosburger.svg"
  }
]
